{
  "version": "1.0.0",
  "generatedAt": "2026-08-20",
  "city": "Abidjan",
  "country": "CI",
  "crs": "EPSG:4326",
  "notes": "Jeu de donnees de test du pilote Abidjan (roadmap Phase 0.5). Coordonnees approximatives saisies a la main a partir de reperes reels ; les contacts telephoniques sont fictifs. Regenerer avec : python data/generate-abidjan-stops.py",
  "depots": [
    {
      "id": "DEP-01",
      "label": "Entrepot SIRA Zone 4",
      "commune": "Marcory",
      "lat": 5.2866,
      "lon": -3.9946,
      "addressText": "Zone industrielle de Zone 4C, Marcory",
      "openFrom": "06:30",
      "openUntil": "19:00"
    },
    {
      "id": "DEP-02",
      "label": "Hub Yopougon Siporex",
      "commune": "Yopougon",
      "lat": 5.3396,
      "lon": -4.0861,
      "addressText": "Siporex, en face de la station, Yopougon",
      "openFrom": "07:00",
      "openUntil": "18:00"
    }
  ],
  "stops": [
    {
      "id": "STP-001",
      "label": "Pharmacie du Plateau",
      "commune": "Plateau",
      "lat": 5.3251,
      "lon": -4.0212,
      "addressText": "Avenue Chardy, Plateau",
      "informalDescription": "Rez-de-chaussee de l'immeuble creme, entre la banque et le kiosque a cafe",
      "landmark": "Avenue Chardy",
      "contactPhone": "+2250132868828",
      "timeWindow": null,
      "loadKg": 1.2,
      "volumeL": 3.1,
      "serviceMinutes": 5,
      "priority": "normal"
    },
    {
      "id": "STP-002",
      "label": "Boutique Tour F",
      "commune": "Plateau",
      "lat": 5.3268,
      "lon": -4.0224,
      "addressText": "Tour F, Cite Administrative, Plateau",
      "informalDescription": "Entree cote parking, demander l'agent de securite du hall B",
      "landmark": "Cite Administrative",
      "contactPhone": "+2250799410741",
      "timeWindow": null,
      "loadKg": 2.0,
      "volumeL": 7.9,
      "serviceMinutes": 8,
      "priority": "normal"
    },
    {
      "id": "STP-003",
      "label": "Restaurant Le Bafing",
      "commune": "Plateau",
      "lat": 5.324,
      "lon": -4.0196,
      "addressText": "Place de la Republique, Plateau",
      "informalDescription": "En face de la fontaine, terrasse bleue au premier etage",
      "landmark": "Place de la Republique",
      "contactPhone": "+2250103999315",
      "timeWindow": {
        "start": "09:00",
        "end": "12:00"
      },
      "loadKg": 1.2,
      "volumeL": 4.4,
      "serviceMinutes": 3,
      "priority": "normal"
    },
    {
      "id": "STP-004",
      "label": "Cabinet Kouassi et Associes",
      "commune": "Plateau",
      "lat": 5.3247,
      "lon": -4.0208,
      "addressText": "Immeuble CCIA, Plateau",
      "informalDescription": "12e etage, se signaler a l'accueil avec le nom du cabinet",
      "landmark": "Immeuble CCIA",
      "contactPhone": "+2250175329037",
      "timeWindow": null,
      "loadKg": 3.5,
      "volumeL": 12.3,
      "serviceMinutes": 3,
      "priority": "normal"
    },
    {
      "id": "STP-005",
      "label": "Kiosque Rue du Commerce",
      "commune": "Plateau",
      "lat": 5.3199,
      "lon": -4.0205,
      "addressText": "Rue du Commerce, Plateau",
      "informalDescription": "Trottoir cote pair, juste apres la librairie, parasol rouge",
      "landmark": "Rue du Commerce",
      "contactPhone": "+2250579089901",
      "timeWindow": null,
      "loadKg": 25.0,
      "volumeL": 83.5,
      "serviceMinutes": 5,
      "priority": "normal"
    },
    {
      "id": "STP-006",
      "label": "Agence Voyages Chardy",
      "commune": "Plateau",
      "lat": 5.3232,
      "lon": -4.0177,
      "addressText": "Marche du Plateau, Plateau",
      "informalDescription": "Angle du marche, portail metallique vert, sonner deux fois",
      "landmark": "Marche du Plateau",
      "contactPhone": "+2250593702683",
      "timeWindow": {
        "start": "10:00",
        "end": "13:00"
      },
      "loadKg": 0.5,
      "volumeL": 2.0,
      "serviceMinutes": 4,
      "priority": "normal"
    },
    {
      "id": "STP-007",
      "label": "Hotel Tiama - reception",
      "commune": "Plateau",
      "lat": 5.3241,
      "lon": -4.0222,
      "addressText": "Boulevard de la Republique, Plateau",
      "informalDescription": "Livrer a la conciergerie, ne pas passer par le parking souterrain",
      "landmark": "Hotel Tiama",
      "contactPhone": "+2250145176955",
      "timeWindow": null,
      "loadKg": 5.0,
      "volumeL": 14.1,
      "serviceMinutes": 10,
      "priority": "normal"
    },
    {
      "id": "STP-008",
      "label": "Clinique Saint Paul",
      "commune": "Plateau",
      "lat": 5.3244,
      "lon": -4.0143,
      "addressText": "Pres de la Cathedrale Saint-Paul, Plateau",
      "informalDescription": "Petite rue derriere la cathedrale, batiment blanc a deux niveaux",
      "landmark": "Cathedrale Saint-Paul",
      "contactPhone": "+2250746164955",
      "timeWindow": null,
      "loadKg": 1.2,
      "volumeL": 3.9,
      "serviceMinutes": 5,
      "priority": "normal"
    },
    {
      "id": "STP-009",
      "label": "Bureau Angoulvant",
      "commune": "Plateau",
      "lat": 5.3298,
      "lon": -4.0181,
      "addressText": "Boulevard Angoulvant, Plateau",
      "informalDescription": "Immeuble avec fresque murale, 3e porte apres le feu tricolore",
      "landmark": "Boulevard Angoulvant",
      "contactPhone": "+2250761662963",
      "timeWindow": {
        "start": "08:00",
        "end": "11:00"
      },
      "loadKg": 5.0,
      "volumeL": 20.6,
      "serviceMinutes": 8,
      "priority": "normal"
    },
    {
      "id": "STP-010",
      "label": "Superette Gare Sud",
      "commune": "Plateau",
      "lat": 5.3171,
      "lon": -4.0207,
      "addressText": "Gare lagunaire de Gare Sud, Plateau",
      "informalDescription": "A 50 m de l'embarcadere des bateaux-bus, enseigne jaune",
      "landmark": "Gare Sud",
      "contactPhone": "+2250784374605",
      "timeWindow": null,
      "loadKg": 12.0,
      "volumeL": 31.9,
      "serviceMinutes": 5,
      "priority": "high"
    },
    {
      "id": "STP-011",
      "label": "Pharmacie Saint Jean",
      "commune": "Cocody",
      "lat": 5.3457,
      "lon": -3.9958,
      "addressText": "Carrefour Saint Jean, Cocody",
      "informalDescription": "En face de la station-service, portail bleu a cote du maquis",
      "landmark": "Carrefour Saint Jean",
      "contactPhone": "+2250109335534",
      "timeWindow": null,
      "loadKg": 8.0,
      "volumeL": 29.2,
      "serviceMinutes": 8,
      "priority": "normal"
    },
    {
      "id": "STP-012",
      "label": "Residence Danga - Villa 12",
      "commune": "Cocody",
      "lat": 5.3402,
      "lon": -3.9998,
      "addressText": "Cite Danga, Cocody",
      "informalDescription": "Entrer par la 2e barriere, villa 12 au fond de l'impasse, chien attache",
      "landmark": "Cite Danga",
      "contactPhone": "+2250131244663",
      "timeWindow": {
        "start": "12:00",
        "end": "15:00"
      },
      "loadKg": 3.5,
      "volumeL": 14.2,
      "serviceMinutes": 3,
      "priority": "normal"
    },
    {
      "id": "STP-013",
      "label": "Sococe II Plateaux",
      "commune": "Cocody",
      "lat": 5.3672,
      "lon": -3.9964,
      "addressText": "Centre commercial Sococe, II Plateaux",
      "informalDescription": "Quai de livraison a l'arriere du centre, badge visiteur obligatoire",
      "landmark": "Sococe",
      "contactPhone": "+2250148966946",
      "timeWindow": null,
      "loadKg": 5.0,
      "volumeL": 17.0,
      "serviceMinutes": 10,
      "priority": "normal"
    },
    {
      "id": "STP-014",
      "label": "Boulangerie Vallon",
      "commune": "Cocody",
      "lat": 5.3676,
      "lon": -3.9953,
      "addressText": "Vallon, II Plateaux, Cocody",
      "informalDescription": "Descendre la rue du Vallon, boulangerie a l'angle apres le lavage auto",
      "landmark": "Vallon",
      "contactPhone": "+2250735833156",
      "timeWindow": null,
      "loadKg": 8.0,
      "volumeL": 25.7,
      "serviceMinutes": 8,
      "priority": "normal"
    },
    {
      "id": "STP-015",
      "label": "Bureau Rue Mercedes",
      "commune": "Cocody",
      "lat": 5.3691,
      "lon": -3.9908,
      "addressText": "Rue Mercedes, II Plateaux, Cocody",
      "informalDescription": "Immeuble R+3 avec parking en pave, 1er etage porte gauche",
      "landmark": "Rue Mercedes",
      "contactPhone": "+2250771691040",
      "timeWindow": {
        "start": "09:00",
        "end": "12:00"
      },
      "loadKg": 1.2,
      "volumeL": 4.5,
      "serviceMinutes": 4,
      "priority": "normal"
    },
    {
      "id": "STP-016",
      "label": "Ecole Angre 8e tranche",
      "commune": "Cocody",
      "lat": 5.3988,
      "lon": -3.9843,
      "addressText": "Angre 8e tranche, Cocody",
      "informalDescription": "Apres le chateau d'eau, grand portail vert, livrer au bureau du surveillant",
      "landmark": "Chateau d'eau d'Angre",
      "contactPhone": "+2250785899313",
      "timeWindow": null,
      "loadKg": 2.0,
      "volumeL": 6.8,
      "serviceMinutes": 5,
      "priority": "normal"
    },
    {
      "id": "STP-017",
      "label": "Maquis Carrefour Duncan",
      "commune": "Cocody",
      "lat": 5.3583,
      "lon": -3.9946,
      "addressText": "Carrefour Duncan, II Plateaux, Cocody",
      "informalDescription": "Sous les paillotes cote gauche du carrefour, demander le gerant",
      "landmark": "Carrefour Duncan",
      "contactPhone": "+2250107507864",
      "timeWindow": null,
      "loadKg": 25.0,
      "volumeL": 73.5,
      "serviceMinutes": 5,
      "priority": "normal"
    },
    {
      "id": "STP-018",
      "label": "Riviera 2 - Immeuble Palmier",
      "commune": "Cocody",
      "lat": 5.3521,
      "lon": -3.9663,
      "addressText": "Riviera 2, Cocody",
      "informalDescription": "Face au terrain de foot, immeuble beige, appartement B4",
      "landmark": "Terrain de foot Riviera 2",